{
  "schema_version": "calendar-daily-acquisition-activation-status-v1",
  "generated_at": "2026-08-01T06:11:40Z",
  "run_id": "30687241433",
  "run_attempt": 1,
  "event_name": "schedule",
  "source_sha": "45c81f1ec98558df5c31d86f6eb8e28ed64abac4",
  "source_ref": "refs/heads/main",
  "plan_result": "success",
  "execute_result": "success",
  "hosted_jobs": 1,
  "plan_id": "due-job-plan-2026-08-01",
  "review_branch": "automation/calendar-daily-acquisition-review",
  "publication_boundary": {
    "automatic_approval": false,
    "canonical_written": false,
    "public_projection_written": false,
    "automatic_merge": false,
    "deployment_performed": false
  }
}
